{"$defs":{"RequirementWire":{"additionalProperties":false,"properties":{"alternatives":{"items":{"items":{"$ref":"#/$defs/TargetWire"},"type":"array"},"type":"array"},"weight_micros":{"format":"uint64","minimum":0,"type":"integer"}},"required":["weight_micros","alternatives"],"type":"object"},"TargetWire":{"oneOf":[{"additionalProperties":false,"properties":{"event_id":{"type":"string"},"kind":{"const":"event","type":"string"}},"required":["kind","event_id"],"type":"object"},{"additionalProperties":false,"properties":{"block_id":{"type":"string"},"kind":{"const":"block","type":"string"}},"required":["kind","block_id"],"type":"object"}]}},"$id":"schemas/evidentrail/v1/bench_annotation_manifest.schema.json","$schema":"https://json-schema.org/draft/2020-12/schema","additionalProperties":false,"properties":{"contract":{"const":"evidentrail.bench.annotation_manifest","type":"string"},"contract_version":{"const":1,"format":"uint16","maximum":9007199254740991,"minimum":0,"type":"integer"},"diagnostic_requirements":{"items":{"$ref":"#/$defs/RequirementWire"},"maxItems":4096,"type":"array"},"distractor_targets":{"items":{"$ref":"#/$defs/TargetWire"},"type":["array","null"]},"precursor_targets":{"items":{"$ref":"#/$defs/TargetWire"},"type":["array","null"]},"public_case_artifact_digest":{"pattern":"^artifact_sha256_[0-9a-f]{64}$","type":"string"},"supporting_targets":{"items":{"$ref":"#/$defs/TargetWire"},"type":["array","null"]},"symptom_targets":{"items":{"$ref":"#/$defs/TargetWire"},"type":["array","null"]},"unsafe_targets":{"items":{"$ref":"#/$defs/TargetWire"},"type":["array","null"]}},"required":["contract","contract_version","public_case_artifact_digest","diagnostic_requirements"],"title":"evidentrail.bench.annotation_manifest","type":"object"}