{"contract":"evidentrail.bench.annotation_manifest","contract_version":1,"diagnostic_requirements":[{"alternatives":[[{"event_id":"evt_0000000000000000000000000000000000000000000000000000000000000000","kind":"event"}]],"weight_micros":1}],"distractor_targets":null,"precursor_targets":null,"public_case_artifact_digest":"artifact_sha256_0000000000000000000000000000000000000000000000000000000000000000","supporting_targets":null,"symptom_targets":null,"unsafe_targets":null}